[
  {
    "requestId": "android-mock-click",
    "sessionId": "session-android-mock",
    "platform": "android",
    "command": "click",
    "payload": {
      "mock": true,
      "locator": {
        "accessibilityId": "demo-button"
      }
    }
  },
  {
    "requestId": "android-mock-swipe",
    "sessionId": "session-android-mock",
    "platform": "android",
    "command": "swipe",
    "payload": {
      "mock": true,
      "from": [0.5, 0.8],
      "to": [0.5, 0.3]
    }
  }
]
