[
  {
    "requestId": "appium-real-click-001",
    "sessionId": "appium-real-session-1",
    "platform": "android",
    "command": "click",
    "payload": {
      "real": true,
      "serverUrl": "http://127.0.0.1:4723",
      "capabilities": {
        "platformName": "Android",
        "appium:automationName": "UiAutomator2",
        "appium:deviceName": "Android",
        "appium:appPackage": "com.android.settings",
        "appium:appActivity": ".Settings"
      },
      "point": [0.5, 0.3]
    }
  },
  {
    "requestId": "appium-real-type-001",
    "sessionId": "appium-real-session-1",
    "platform": "android",
    "command": "type",
    "payload": {
      "real": true,
      "serverUrl": "http://127.0.0.1:4723",
      "capabilities": {
        "platformName": "Android",
        "appium:automationName": "UiAutomator2",
        "appium:deviceName": "Android"
      },
      "locator": {
        "id": "android:id/search_src_text"
      },
      "text": "hello-ada"
    }
  },
  {
    "requestId": "appium-real-assert-001",
    "sessionId": "appium-real-session-1",
    "platform": "android",
    "command": "assertVisible",
    "payload": {
      "real": true,
      "serverUrl": "http://127.0.0.1:4723",
      "capabilities": {
        "platformName": "Android",
        "appium:automationName": "UiAutomator2",
        "appium:deviceName": "Android"
      },
      "locator": {
        "id": "android:id/search_src_text"
      }
    }
  },
  {
    "requestId": "appium-real-shot-001",
    "sessionId": "appium-real-session-1",
    "platform": "android",
    "command": "screenshot",
    "payload": {
      "real": true,
      "serverUrl": "http://127.0.0.1:4723",
      "capabilities": {
        "platformName": "Android",
        "appium:automationName": "UiAutomator2",
        "appium:deviceName": "Android"
      }
    }
  },
  {
    "requestId": "appium-real-swipe-001",
    "sessionId": "appium-real-session-1",
    "platform": "android",
    "command": "swipe",
    "payload": {
      "real": true,
      "serverUrl": "http://127.0.0.1:4723",
      "capabilities": {
        "platformName": "Android",
        "appium:automationName": "UiAutomator2",
        "appium:deviceName": "Android"
      },
      "from": [0.5, 0.8],
      "to": [0.5, 0.3]
    }
  }
]
