[
  {
    "requestId": "selenium-ff-real-nav",
    "sessionId": "selenium-ff-real",
    "platform": "web",
    "command": "navigate",
    "payload": {
      "engine": "selenium",
      "browserName": "firefox",
      "url": "https://example.com"
    }
  },
  {
    "requestId": "selenium-ff-real-title",
    "sessionId": "selenium-ff-real",
    "platform": "web",
    "command": "invoke",
    "payload": {
      "engine": "selenium",
      "mode": "method",
      "target": "driver",
      "method": "getTitle",
      "args": []
    }
  },
  {
    "requestId": "selenium-ff-real-shot",
    "sessionId": "selenium-ff-real",
    "platform": "web",
    "command": "screenshot",
    "payload": {
      "engine": "selenium",
      "screenshotPath": "artifacts/selenium-firefox-real.png"
    }
  }
]
