[
  {
    "requestId": "ff-local-nav-001",
    "sessionId": "firefox-local-session",
    "platform": "web",
    "command": "navigate",
    "payload": {
      "url": "https://example.com",
      "browser": "firefox",
      "headless": false
    }
  },
  {
    "requestId": "ff-local-title-001",
    "sessionId": "firefox-local-session",
    "platform": "web",
    "command": "invoke",
    "payload": {
      "browser": "firefox",
      "headless": false,
      "target": "page",
      "method": "title",
      "args": []
    }
  },
  {
    "requestId": "ff-local-shot-001",
    "sessionId": "firefox-local-session",
    "platform": "web",
    "command": "screenshot",
    "payload": {
      "browser": "firefox",
      "headless": false,
      "fullPage": true
    }
  },
  {
    "requestId": "ff-local-click-001",
    "sessionId": "firefox-local-session",
    "platform": "web",
    "command": "click",
    "payload": {
      "browser": "firefox",
      "headless": false,
      "locator": { "text": "More information" }
    }
  },
  {
    "requestId": "ff-local-wait-001",
    "sessionId": "firefox-local-session",
    "platform": "web",
    "command": "wait",
    "payload": {
      "browser": "firefox",
      "headless": false,
      "timeoutMs": 1500
    }
  },
  {
    "requestId": "ff-local-url-001",
    "sessionId": "firefox-local-session",
    "platform": "web",
    "command": "invoke",
    "payload": {
      "browser": "firefox",
      "headless": false,
      "target": "page",
      "method": "url",
      "args": []
    }
  },
  {
    "requestId": "ff-local-back-001",
    "sessionId": "firefox-local-session",
    "platform": "web",
    "command": "back",
    "payload": {
      "browser": "firefox",
      "headless": false
    }
  },
  {
    "requestId": "ff-local-reload-001",
    "sessionId": "firefox-local-session",
    "platform": "web",
    "command": "reload",
    "payload": {
      "browser": "firefox",
      "headless": false
    }
  },
  {
    "requestId": "ff-local-shot-final-001",
    "sessionId": "firefox-local-session",
    "platform": "web",
    "command": "screenshot",
    "payload": {
      "browser": "firefox",
      "headless": false,
      "fullPage": false
    }
  }
]
